{
  "name": "rust",
  "version": "1.0.0",
  "description": "Skills for Rust development: exploring crate documentation, creating skills for crates, and writing Tera templates",
  "author": {
    "name": "Tarq"
  },
  "license": "MIT",
  "keywords": [
    "rust",
    "cargo",
    "documentation",
    "crates",
    "skill-creation",
    "tera",
    "templates"
  ]
}
